ID,Name,Latitude,Longitude,Description,Website,Tags,Image,Address,Phone,Email,Category,Contact Person,Last Checked,Additional Info
1,Tower of London,51.5081,-0.0759,Historic castle and fortress,https://www.hrp.org.uk/tower-of-london,"castle, medieval, royal, landmark",,"St Katharine's & Wapping, London EC3N 4AB, United Kingdom",+44 20 3166 6000,info@hrp.org.uk,Historic Site,John Doe,2025-02-25,"The Tower of London, officially Her Majesty's Royal Palace and Fortress of the Tower of London, is a historic castle and fortress located on the north bank of the River Thames in central London."
2,Westminster Abbey,51.4994,-0.1276,Gothic church and UNESCO site,https://www.westminster-abbey.org,"church, gothic, unesco, royal",,"20 Deans Yd, Westminster, London SW1P 3PA, United Kingdom",+44 20 7222 5152,info@westminster-abbey.org,Religious Site,Jane Smith,2025-02-25,"Westminster Abbey, formally titled the Collegiate Church of Saint Peter at Westminster, is a historic, mainly Gothic abbey church in the City of Westminster, London, England."
3,British Museum,51.5194,-0.127,World culture and history museum,https://www.britishmuseum.org,"art, history, culture, archaeology",,"Great Russell St, Bloomsbury, London WC1B 3DG, United Kingdom",+44 20 7323 8299,information@britishmuseum.org,Museum,Alex Brown,2025-02-25,"The British Museum is a public museum dedicated to human history, art, and culture. Its permanent collection of eight million works is among the largest and most comprehensive in existence."
4,Natural History Museum,51.4967,-0.1764,Natural history collections,https://www.nhm.ac.uk,"science, nature, dinosaurs, geology",,"Cromwell Rd, South Kensington, London SW7 5BD, United Kingdom",+44 20 7942 5000,info@nhm.ac.uk,Museum,Emily White,2025-02-25,The Natural History Museum in London is a natural history museum that exhibits a vast range of specimens from various segments of natural history.
5,Hyde Park,51.5073,-0.1657,Royal park in central London,https://www.royalparks.org.uk/parks/hyde-park,"nature, recreation, royal, outdoor",,"Hyde Park, London W2 2UH, United Kingdom",+44 300 061 2000,hyde@royalparks.org.uk,Park,Michael Green,2025-02-25,Hyde Park is a Grade I-listed major park in Central London. It is the largest of four Royal Parks that form a chain from the entrance of Kensington Palace through Kensington Gardens and Hyde Park.
6,Regent's Park,51.5313,-0.157,Historic park and gardens,https://www.royalparks.org.uk/parks/the-regents-park,"nature, gardens, royal, outdoor",,"Chester Rd, London NW1 4NR, United Kingdom",+44 300 061 2300,regents@royalparks.org.uk,Park,Sarah Johnson,2025-02-25,"The Regent's Park is one of London's eight Royal Parks and covers an area of 395 acres. It includes stunning rose gardens with more than 12,000 roses of 400 varieties."